Question,A,B,C,D
"Which word would you find on a dictionary page with the following guide words?
path - polar",plum,push,,
"What kind of sentence is this?
Will you be here again next Wednesday?",interrogative,declarative,,
"What does the idiom in this text suggest?
Cell phones once cost an arm and a leg, but today the majority of people can afford them.",Cell phones were once very expensive.,Cell phones once varied greatly in price.,,
Suppose Haley decides to see the leopards. Which result would be a cost?,"Haley will spend more time walking to the leopards. They are on the other side of the zoo, but the elephants are close by.",Haley will enjoy seeing the leopards more than she would have enjoyed seeing the elephants.,,
"What is the source of the allusion in the sentence below?
The national park is truly a Garden of Eden.",the Bible,a song,,
"Would you find the word dad on a dictionary page with the following guide words?
degree - doll",no,yes,,
"Which type of sentence is this?
Anna is a competitive horseback rider, and she will be competing in the next World Equestrian Games, which are held every four years.",compound-complex,simple,complex,compound
"Which word would you find on a dictionary page with the following guide words?
hair - holly",humble,history,,
Is there a surplus or a shortage of bunk beds?,shortage,surplus,,
"Which word would you find on a dictionary page with the following guide words?
book - bulletin",back,brave,,
"What is the source of the allusion in the sentence below?
Kendra was known among her coworkers for her spartan ways.",Greek history,Shakespeare,,
Suppose Duncan decides to join the Photography Club. Which result would be a cost?,Duncan will save some time. He would have spent more time in the Theater Club than in the Photography Club.,Duncan will give up the chance to be in the Theater Club. He would have had more fun in the Theater Club than in the Photography Club.,,
Which press release is more formal?,"On November 19, the Newton Amphitheater will host area musicians vying for top honors in the fourth annual Jam-a-thon.","On Nov. 19, musicians from all over town will battle it out in the fourth annual Jam-a-thon, happening at the amphitheater.",,
"Which word would you find on a dictionary page with the following guide words?
mellow - murmur",mound,mascot,,
"What kind of sentence is this?
Do you know Jonah from soccer camp, or do you have another connection with him?",declarative,imperative,interrogative,
"Which word would you find on a dictionary page with the following guide words?
riddle - rye",robber,reduce,,
"Which type of sentence is this?
Colin always approaches difficult tasks enthusiastically, and he frequently motivates others with his energy and fervor.",compound,simple,complex,compound-complex
Suppose Vincent decides to take a trip to Tennessee. Which result would be a cost?,Vincent will give up the chance to go to New York. He would have enjoyed a trip to New York more than Tennessee.,Vincent will save some money. Plane tickets for Vincent to get to Tennessee are less expensive than tickets to New York.,,
"What is the source of the allusion in the sentence below?
Before Vicky had even met her future husband in person, she knew about his reputation as a Romeo.",literature,British history,,
"Which figure of speech is used in this text?
After spending weeks in New York City, Camille was a bit unnerved by the deafening silence of her small hometown.",oxymoron,euphemism,,
"Which figure of speech is used in this text?
Dr. Kelly is unhappy with her new assistant because simple tasks, like fetching coffee, take him years to finish.",hyperbole,oxymoron,,
"Read the following excerpt from a student essay. How can the writer best improve his or her ideas and development?
In the second half of the story, the man finally recognizes the power of nature. He tries to build a fire because of the extremely cold temperature. He is able to start a fire, so he thinks he will survive. However, melting ice from the branches above extinguishes the fire. His half-frozen fingers are too stiff to move, so he clutches desperately to relight the fire. Despite having plenty of matches, he realizes that he won't be able to make it.",by including more examples from the text,by removing the second main idea,by including more analysis,
"Which logical fallacy is used in the text?
How do I know that Meg is the most intelligent person in our geometry class? I know because she's so smart.",ad hominem: a personal attack against one's opponent,circular reasoning: an argument that supports a claim with the claim itself,,
"Which type of sentence is this?
Since it takes approximately one thousand years for a used printer cartridge to decompose, recycling these plastic ink dispensers helps the environment.",compound-complex,compound,complex,simple
"What is the source of the allusion in the sentence below?
Looking at his life, we couldn't help but see Doug as a Job-like figure.",the Bible,Greek mythology,,
"Which tense does the sentence use?
The loud thunder will wake the baby.",future tense,present tense,past tense,
Is a cupcake a good or a service?,a good,a service,,
"Which word would you find on a dictionary page with the following guide words?
mechanic - monk",mission,market,,
"Which figure of speech is used in this text?
Dan's room is as tidy as an overgrown garden.",verbal irony,pun,,
"Which word would you find on a dictionary page with the following guide words?
riddle - ruby",royal,rack,,
"Which type of sentence is this?
If we can't find an inexpensive hotel for the Fourth of July weekend, we can always stay with my parents.",compound,simple,compound-complex,complex
"Which word would you find on a dictionary page with the following guide words?
banner - brain",bulge,blew,,
"Which logical fallacy is used in the text?
The number of off-leash dogs I've seen in Booneville is completely unacceptable. Let's make our streets safe again by addressing this dog problem, before our city becomes a haven for criminals.","false causation: the assumption that because two things happened together, one caused the other",red herring: the use of a completely unrelated topic or idea,,
"Last year, 50,000 people lived in the city of Wildgrove. But since then, 8,000 people have moved away. What probably happened to the overall supply of houses for sale in Wildgrove?",The supply probably went up.,The supply probably went down.,,
"Which word would you find on a dictionary page with the following guide words?
oar - orphan",ought,oh,,
"Which word would you find on a dictionary page with the following guide words?
scramble - shellac",second,sad,,
"Would you find the word woke on a dictionary page with the following guide words?
wear - while",no,yes,,
Is a bed a good or a service?,a good,a service,,
"Which type of sentence is this?
The vibrant trumpet-shaped blooms of the trumpet vine make it ideal for attracting hummingbirds.",simple,compound,complex,compound-complex
"Would you find the word ago on a dictionary page with the following guide words?
accent - ashamed",no,yes,,
"Which word would you find on a dictionary page with the following guide words?
lead - lodge",liver,lava,,
"Which tense does the sentence use?
The children will exchange gifts at the event.",past tense,future tense,present tense,
"What is the source of the allusion in the sentence below?
Mrs. Randolph decided not to argue with the name her daughter had chosen for their new kitten, figuring it was a matter of a rose by any other name.",Shakespeare,a poem,,
"Complete the sentence so that it uses personification.
The car engine () as Mr. Cooper tried to start it in the freezing cold.",coughed,failed,,
"Which tense does the sentence use?
I will point her out to you.",past tense,present tense,future tense,
"What is the source of the allusion in the sentence below?
Ed says that he would not be the person he is today were it not for his childhood, which he describes as Dickensian.",a poem,literature,,
"Which word would you find on a dictionary page with the following guide words?
person - plug",pity,preserve,,
"Would you find the word legend on a dictionary page with the following guide words?
large - like",no,yes,,
"Read the following excerpt from a student essay. How can the writer best improve his or her ideas and development?
In Amy Tan's The Joy Luck Club, four Chinese American daughters and their more traditional Chinese mothers try to reconcile their cultural differences. When the daughters are young girls, they are embarrassed by their mothers and think they are strange. The mothers feel misunderstood by their daughters. As the girls grow into women, their attitudes change. Over time, the mothers and daughters develop a new appreciation for one another.",by clearly stating the main idea,by removing a second main idea,by including specific examples from the text,
"What kind of sentence is this?
Follow me in a single-file line.",exclamatory,imperative,,
"Which figure of speech is used in this text?
Sally's Bistro used to be a great place to go for a delicious and carefully prepared dinner, but nobody goes there anymore: it's too crowded.",paradox,oxymoron,,
"What does the personification in this text suggest?
It was the early afternoon of a sunshiny day with little winds playing hide-and-seek in it.
—Katherine Mansfield, ""How Pearl Button Was Kidnapped""",There was very little wind.,There were occasional gusts of wind.,,
"What does the metaphor in this text suggest?
Eve felt a roller coaster of emotions when she heard the news.",Eve found the news scary.,Eve had varied feelings.,,
"Which figure of speech is used in this text?
Sofia, I've told you a million times: you need to dry the dishes before you put them away.",hyperbole,paradox,,
"Which figure of speech is used in this text?
Ellie gazed at the ancient pug that seemed to sleep all day and noted, ""You're an energetic puppy!""",idiom,verbal irony,,
"Which figure of speech is used in this text?
The comedy show was a huge success. The audience was dying of laughter the entire time.",hyperbole,euphemism,,
"Would you find the word turn on a dictionary page with the following guide words?
tangerine - thy",no,yes,,
"What does the idiom in this text suggest?
Reba has a lot on her plate: she is attending college, has a full-time job as a waitress, and volunteers at the animal shelter.",Reba has worked up an appetite.,Reba has many responsibilities.,,
"Which type of sentence is this?
Manny took several incredible panoramic photographs of the sweeping view from the top of Table Mountain.",compound,complex,compound-complex,simple
"What kind of sentence is this?
Helen considers Paris the most romantic city in the world.",exclamatory,declarative,interrogative,
"Long ago, all books were copied by hand. Making new copies was a lot of work and took a long time. But the invention of the printing press made copying books faster and easier. What happened to the overall supply of books after the printing press was invented?",The supply went up.,The supply went down.,,
"Which tense does the sentence use?
The plane will land in Tokyo.",future tense,present tense,past tense,
"Which word would you find on a dictionary page with the following guide words?
daily - dirt",decorate,domino,,
"Which figure of speech is used in this text?
Shelley's Boutique claims to have ""something for everyone,"" but it is generally understood that their target market is women of a certain age.",paradox,euphemism,,
"Would you find the word ring on a dictionary page with the following guide words?
ran - return",no,yes,,
"Which type of sentence is this?
Julia is a competitive horseback rider, and she will be competing in the next World Equestrian Games, which are held every four years.",compound,simple,complex,compound-complex
"Which tense does the sentence use?
The basketball game will begin in a minute.",future tense,present tense,past tense,
"What is the source of the allusion in the sentence below?
Nate was enjoying the lush life his newfound riches had brought him, but he couldn't help but think of his latest cholesterol reading as a Sword of Damocles.",ancient legend,Shakespeare,,
Suppose Mia decides to borrow the book from the library. Which result would be a cost?,Mia will save some money by not buying the book.,Mia will give up the chance to keep the book as long as she wants.,,
"Would you find the word boulder on a dictionary page with the following guide words?
bike - bridge",yes,no,,
"Which logical fallacy is used in the text?
My father asked me to help around the house more. I can't believe he doesn't want me to spend time with my friends.",appeal to nature: the assumption that natural things are always good,circular reasoning: an argument that supports a claim with the claim itself,straw man: a misrepresentation of an opponent's position that makes it easier to argue against,
"What is the source of the allusion in the sentence below?
Julie warned her youngest son not to cry wolf while wrestling with his older brother.",U.S. history,a fable,,
Suppose Vicky decides to see the hippopotamuses. Which result would be a cost?,"Vicky will spend more time walking to the hippopotamuses. They are on the other side of the zoo, but the storks are close by.",Vicky will enjoy seeing the hippopotamuses more than she would have enjoyed seeing the storks.,,
"Which tense does the sentence use?
The cousins will complete the puzzle before long.",past tense,future tense,present tense,
"What does the verbal irony in this text suggest?
According to Mr. Carter's kids, his snoring is as quiet as a jackhammer.",The snoring occurs in bursts.,The snoring is loud.,,
"What is the source of the allusion in the sentence below?
Jenny was known among her coworkers for her spartan ways.",Shakespeare,Greek history,,
"Does the sentence use a simile or a metaphor?
From across the room, Uncle Logan's laughter was booming thunder.",simile,metaphor,,
"Which word would you find on a dictionary page with the following guide words?
caribou - crunch",cuff,clock,,
"Read the following text from a student essay. How can the writer best improve his or her grammar and mechanics?
Everyone agree that recess is important for children in elementary school, but what about middle school students? I believe that students in middle school needs time to relax and have fun during the school day. A period of free time in the afternoons give students the opportunity to go outside and enjoy some fresh air. Studies shows that exercise benefits students' attention spans. Exercise can also reduce stress, which many middle school students face on a daily basis. Therefore, middle school students in our country deserves recess, too.",by fixing subject-verb agreement errors,by adding missing commas,,
"Which word would you find on a dictionary page with the following guide words?
angle - assign",architect,afford,,
"Which figure of speech is used in this text?
You're easy on the eyes,
Hard on the heart
—Terri Clark, ""You're Easy on the Eyes""",anaphora,antithesis,,
Suppose Bella decides to take a trip to Michigan. Which result would be a cost?,Bella will give up the chance to go to North Dakota. She would have enjoyed a trip to North Dakota more than Michigan.,Bella will save some money. Plane tickets for Bella to get to Michigan are less expensive than tickets to North Dakota.,,
"Which figure of speech is used in this text?
I must have eaten too much of Jacob's homemade chili, because now I'm so full I could explode!",paradox,hyperbole,,
"Is this a run-on sentence?
The first car that Mr. Castro bought is still the most precious in his collection it's a 1971 Chevrolet Chevelle.",yes,no,,
"What is the source of the allusion in the sentence below?
Scott got off the mountain by the skin of his teeth.",the Bible,a movie,,
"Which word would you find on a dictionary page with the following guide words?
pleasant - push",protect,parrot,,
"Which word would you find on a dictionary page with the following guide words?
galleon - glorious",gently,goose,,
"Would you find the word and on a dictionary page with the following guide words?
afraid - area",yes,no,,
"Which figure of speech is used in this text?
When the coach asked whether we wanted to try out the new trampoline, we jumped at the chance.",pun,simile,,
"Which figure of speech is used in this text?
Rosanne's Boutique claims to have ""something for everyone,"" but it is generally understood that their target market is women of a certain age.",euphemism,oxymoron,,
"What is the source of the allusion in the sentence below?
My sister takes the lion's share of the space in our closet.",a fable,a song,,
"Which type of sentence is this?
Becky is a competitive horseback rider, and she will be competing in the next World Equestrian Games, which are held every four years.",compound,complex,simple,compound-complex
"What is the source of the allusion in the sentence below?
Frank's Falstaffian nature makes him stand out at a party.",Shakespeare,the Bible,,
"Which tense does the sentence use?
Jenna orders a roast beef sandwich.",present tense,past tense,future tense,
"Which type of sentence is this?
As Brian sat down on the rickety old chair, it abruptly collapsed beneath him.",simple,compound-complex,complex,compound
"Which word would you find on a dictionary page with the following guide words?
dreadful - dye",dodge,dump,,
Which confirmation text message is more formal?,"Thanks 4 confirming your appt. C U on Mon, 1/17 @ 10.","Thank you for confirming your appointment. We'll see you on Monday, January 17, at 10 A.M.",,
"Which figure of speech is used in this text?
Mia's sweater shrank just a bit. It fits her baby sister now.",apostrophe,understatement,,
"Which figure of speech is used in this text?
Kamal returned to the parking lot to find his car somewhat destroyed. Apparently someone had crashed into it while he was working and had broken the entire front windshield.",oxymoron,euphemism,,
"Would you find the word accuse on a dictionary page with the following guide words?
another - away",yes,no,,
"What does the allusion in this text suggest?
With the gutters clogged and water rising in the streets, Christine, who was watching the storm from her window, commented, ""We're going to need an ark to get out of here.""",Christine wants to protect her possessions.,Christine thinks the storm will cause major flooding.,,
"Which logical fallacy is used in the text?
Bert is not qualified to run the Environmental Club. Have you seen his sister's huge, horrifically inefficient car? The planet cries whenever she turns on the ignition.",slippery slope fallacy: the false assumption that a small first step will lead to extreme consequences,false dichotomy: an argument that presents only two choices when more options exist,guilt by association: a negative association intended to discredit someone or something,
"Which tense does the sentence use?
Someone will raise the flag in the morning.",present tense,future tense,past tense,
"Which figure of speech is used in this text?
In the overmastering loneliness of that moment, his whole life seemed to him nothing but vanity.
—Robert Penn Warren, Night Rider",assonance,antithesis,,
"What kind of sentence is this?
Lucy is completely soaked!",declarative,exclamatory,,
"What is the source of the allusion in the sentence below?
Greta was known among her coworkers for her spartan ways.",Shakespeare,Greek history,,
"Which figure of speech is used in this text?
My sister always wears at least five pieces of jewelry, but I prefer to follow the guideline ""Less is more.""",paradox,euphemism,,
"Which word would you find on a dictionary page with the following guide words?
fair - formal",film,freckle,,
"Is this a run-on sentence?
Helsinki, Finland, is developing a ""mobility on demand"" system in which individual can use their smartphones to order trips with various mass transit options, including buses, bicycles, and driverless cars.",no,yes,,
"What is the source of the allusion in the sentence below?
Mr. Nolan has a reputation as a Scrooge, so our club has stopped asking him for donations.",the Bible,literature,,
"Does the sentence use a simile or a metaphor?
On that winter morning, Elizabeth's hands were as cold as ice.",metaphor,simile,,
"Which figure of speech is used in this text?
Although the author Norman Mailer is no longer with us, his writings live on. His Pulitzer Prize-winning book, The Executioner's Song, remains a classic example of his unique style of writing.",euphemism,hyperbole,,
"Which word would you find on a dictionary page with the following guide words?
unhappy - urgent",us,upon,,
"What kind of sentence is this?
Mr. McDowell gave a lecture on water conservation, during which he stressed the importance of not watering lawns during a drought.",exclamatory,declarative,interrogative,
"Which logical fallacy is used in the text?
Did you hear? A bunch of Kamal's friends were at that protest that got out of hand. I had no idea that Kamal was such a troublemaker.",guilt by association: a negative association intended to discredit someone or something,circular reasoning: an argument that supports a claim with the claim itself,false dichotomy: an argument that presents only two choices when more options exist,
"What kind of sentence is this?
Tammy gave me flowers for no reason.",exclamatory,declarative,,
"Which figure of speech is used in this text?
Abdul's '64 Impala groaned as he turned the ignition. Yet again he resolved to refurbish it over the summer.",personification,simile,,
"Which figure of speech is used in this text?
As a result of the recent merger, twenty people in the regional sales division were let go. Most of the work will now be done by the marketing team.",euphemism,hyperbole,,
"Would you find the word papoose on a dictionary page with the following guide words?
pitch - pork",yes,no,,
"Which tense does the sentence use?
Erica and Vicky win the game every time.",past tense,future tense,present tense,
"Which type of sentence is this?
Russia has a variety of natural resources, including oil, natural gas, timber, iron ore, copper, and lead.",compound-complex,simple,complex,compound
"Would you find the word soot on a dictionary page with the following guide words?
shove - sponge",no,yes,,
"Would you find the word capsule on a dictionary page with the following guide words?
child - curse",yes,no,,
"Which figure of speech is used in this text?
Eric remarked that the new book on anti-gravity was impossible to put down.",pun,alliteration,,
"Would you find the word shower on a dictionary page with the following guide words?
seven - strange",yes,no,,
"Would you find the word scooter on a dictionary page with the following guide words?
shop - swept",yes,no,,
"Would you find the word softly on a dictionary page with the following guide words?
seventh - sting",yes,no,,
"What does the verbal irony in this text suggest?
According to Mr. Austin's kids, his snoring is as quiet as a jackhammer.",The snoring occurs in bursts.,The snoring is loud.,,
"What is the source of the allusion in the sentence below?
Josie entered the bustling, aromatic spice market in Istanbul and said to her travel companion, ""We're not in Kansas anymore.""",a movie,a poem,,
"What is the source of the allusion in the sentence below?
The drought is worsening, and the state politicians are fiddling while Rome burns!",a poem,history,,
"Would you find the word blink on a dictionary page with the following guide words?
bet - button",yes,no,,
"Which figure of speech is used in this text?
Ladies and gentlemen, this is your captain speaking. We have a small problem. All four engines have stopped . . . I trust you are not in too much distress.
—Captain Eric Moody, after his Boeing 747's engines failed",assonance,understatement,,
"Which type of sentence is this?
As Dan sat down on the rickety old chair, it abruptly collapsed beneath him.",simple,compound-complex,compound,complex
"What does the verbal irony in this text suggest?
According to Mr. Lam's kids, his snoring is as quiet as a jackhammer.",The snoring is subtle.,The snoring is loud.,,
"Which logical fallacy is used in the text?
Don't be deceived by Beth Everett's articles on rural, blue-collar workers. Her husband is a fancy investment banker, so she can't possibly understand their situation.",guilt by association: a negative association intended to discredit someone or something,circular reasoning: an argument that supports a claim with the claim itself,appeal to nature: the assumption that natural things are always good,
"Which figure of speech is used in this text?
So we beat on . . . borne back ceaselessly into the past.
—F. Scott Fitzgerald, The Great Gatsby",alliteration,simile,,
"What kind of sentence is this?
That's the best bakery in town!",exclamatory,interrogative,,
"Complete the sentence so that it uses personification.
The wind blew through my hair and () my ears.",whispered in,chilled,,
"Which logical fallacy is used in the text?
Krysta has no school spirit—she never comes to any of our football games.",false dichotomy: an argument that presents only two choices when more options exist,appeal to nature: the assumption that natural things are always good,,
"What does the verbal irony in this text suggest?
""This salsa could use a little more spice,"" Josh said as he gulped down water and wiped tears from his eyes.",The salsa was tasteless.,The salsa was too spicy.,,
"Would you find the word precious on a dictionary page with the following guide words?
paper - push",no,yes,,
"Would you find the word pulp on a dictionary page with the following guide words?
pledge - precious",yes,no,,
"Complete the sentence so that it uses personification.
The wind () dispersed the leaves that Zane had spent so long raking.",completely,carelessly,,
