Question,A,B,C,D
"Which type of sentence is this?
Reggie always approaches difficult tasks enthusiastically, and he frequently motivates others with his energy and fervor.",simple,complex,compound-complex,compound
"Is there a sentence fragment?
When it comes to seafood, Americans aren't always eating what they think they are. According to an FDA report based on DNA analysis of fish that are frequently misidentified.",no,yes,,
"Which figure of speech is used in this text?
Jessica's sweater shrank just a bit. It fits her baby sister now.",apostrophe,understatement,,
"What kind of sentence is this?
That screeching hurts my ears!",interrogative,exclamatory,,
"What kind of sentence is this?
Does Janice prefer pizza or pasta?",interrogative,exclamatory,,
"Is this a run-on sentence?
White chocolate does not contain cocoa solids, it contains milk solids, cocoa butter, sugar, and flavorings such as vanilla.",no,yes,,
"Which figure of speech is used in this text?
The old wooden rocking chair that Bridget brought home from the rummage sale was as comfortable as a bed of nails.",alliteration,verbal irony,,
"Would you find the word fence on a dictionary page with the following guide words?
forecast - furnish",no,yes,,
"Which figure of speech is used in this text?
Kinsley swore she would never go back to Oak Grove, but I told her she should never say never. The city might be a very different place in ten years.",oxymoron,paradox,,
"Complete the sentence so that it uses personification.
The long-ignored book sat () on the nightstand.",unread,patiently,,
"Would you find the word teeth on a dictionary page with the following guide words?
talk - thy",yes,no,,
"Would you find the word adopt on a dictionary page with the following guide words?
about - ashes",yes,no,,
"Would you find the word going on a dictionary page with the following guide words?
glove - guitar",no,yes,,
"Which figure of speech is used in this text?
He that is of the opinion money will do everything may well be suspected of doing everything for money.
—Benjamin Franklin, Poor Richard's Almanack",chiasmus,apostrophe,,
"Would you find the word mill on a dictionary page with the following guide words?
marry - moment",no,yes,,
"Read the following excerpt from a student essay. How can the writer best improve his or her sentence fluency?
A 2013 study by Arizona State University's W. P. Carey School of Business examined the relationship between customers and companies in the United States. According to the study, customer satisfaction remains low. Customer satisfaction levels are on par with those reported in the 1970s. One issue is that customers often have to wait a long time to speak to a company representative about their complaint. Even when they finally do manage talk to someone, they may get neither the desired results nor an apology.",by varying how sentences begin,by combining sentences that contain similar information,by using shorter sentences,
"What kind of sentence is this?
Meet me at my house at noon.",interrogative,imperative,,
"Which logical fallacy is used in the text?
Jonah, you drive a beat-up car from the 1980s. For this reason, we can never allow you to be a lifeguard at the community pool.",ad hominem: a personal attack against one's opponent,"false causation: the assumption that because two things happened together, one caused the other",,
"Which logical fallacy is used in the text?
How do I know that Samantha is the most intelligent person in our geometry class? I know because she's so smart.",circular reasoning: an argument that supports a claim with the claim itself,appeal to nature: the assumption that natural things are always good,,
"Would you find the word peril on a dictionary page with the following guide words?
path - plaster",no,yes,,
"What is the source of the allusion in the sentence below?
Especially in summer, the upper deck of the health club offered a sybaritic escape.",British history,Greek history,,
"Which figure of speech is used in this text?
After Brenna cooked and served a scrumptious dinner, Dad boasted that she is the Julia Child of our family.",allusion,pun,,
"What kind of sentence is this?
I can't believe this is Linda's first time seeing the Pacific Ocean!",interrogative,exclamatory,declarative,
"Which figure of speech is used in this text?
The residents of Detroit will be delighted by today's forecast; they can expect another unpleasant weekend of heavy snow, sleet, and ice.",simile,verbal irony,,
"What does the hyperbole in this text suggest?
After he finished the marathon, Jacob collapsed into a chair and declared that he could no longer move a single muscle.",Jacob was very tired and sore.,Jacob became paralyzed.,,
"Which word would you find on a dictionary page with the following guide words?
babies - blew",bite,brass,,
"Which tense does the sentence use?
Mr. Benton will repeat the numbers to the class.",present tense,past tense,future tense,
"Which logical fallacy is used in the text?
This lunch meat has absolutely no additives, so it must be nutritious.",appeal to nature: the assumption that natural things are always good,circular reasoning: an argument that supports a claim with the claim itself,,
"What kind of sentence is this?
I can't wait to get my driver's license!",declarative,interrogative,exclamatory,
"Which figure of speech is used in this text?
I am just going outside and may be some time.
—Captain Lawrence Oates, Antarctic explorer, before going out into subzero temperatures to face certain death",understatement,chiasmus,,
"What is the source of the allusion in the sentence below?
Gary spoke at the city council meeting, claiming the new recycling regulations were draconian.",a fairy tale,Greek history,,
"Which figure of speech is used in this text?
Milton! Thou shouldst be living at this hour
England hath need of thee . . .
—William Wordsworth, ""London, 1802""",antithesis,apostrophe,,
"The city of Oxford has been one of the world's biggest makers of cough drops for many years. But last month, Oxford's cough drop factories were destroyed by floods. What will probably happen to the overall supply of cough drops?",The supply will probably go down.,The supply will probably go up.,,
"Which word would you find on a dictionary page with the following guide words?
scan - swung",spent,sacrifice,,
"Which figure of speech is used in this text?
""There's nothing I love more than skipping lunch,"" Mr. Taylor told the flight attendant when he learned that no food would be available on his cross-country flight.",verbal irony,allusion,,
"What kind of sentence is this?
I can't believe this is Tracy's first time seeing the Pacific Ocean!",exclamatory,declarative,interrogative,
"Would you find the word confuse on a dictionary page with the following guide words?
chair - civilian",yes,no,,
"Is there a sentence fragment?
We called a taxi for Mr. Wells. Whose car was towed from the no-parking zone in front of the firehouse.",yes,no,,
"Which tense does the sentence use?
I will try the chicken soup for lunch.",past tense,present tense,future tense,
"What is the source of the allusion in the sentence below?
Kenji described the situation he was facing with his boss as a catch-22.",a song,literature,,
"Would you find the word general on a dictionary page with the following guide words?
gloomy - grew",no,yes,,
"What is the source of the allusion in the sentence below?
My mom is a partner at a prominent law firm; she's not exactly Carol Brady.",television,modern history,,
"What is the source of the allusion in the sentence below?
Jill thinks Mr. Hardin is a Luddite because he doesn't own a cell phone.",the Bible,British history,,
"Which word would you find on a dictionary page with the following guide words?
eat - everyday",explode,escape,,
"Is this a sentence fragment?
Closed to visitors since the 1960s, the prehistoric cave paintings in Lascaux, France, are between fifteen thousand and seventeen thousand years old.",no,yes,,
"Complete the sentence so that it uses personification.
Displayed next to the other books with more eye-catching covers, this one seemed () by comparison.",shy,ordinary,,
"Which logical fallacy is used in the text?
Jayden's definitely voting for the Conservative Party in the next election because he said there was no way he was voting for the Labour Party.",appeal to nature: the assumption that natural things are always good,slippery slope fallacy: the false assumption that a small first step will lead to extreme consequences,false dichotomy: an argument that presents only two choices when more options exist,
"Which type of sentence is this?
Mark took several incredible panoramic photographs of the sweeping view from the top of Table Mountain.",compound-complex,compound,simple,complex
"Which word would you find on a dictionary page with the following guide words?
wares - wise",which,wore,,
"Which word would you find on a dictionary page with the following guide words?
plus - puff",patrol,poke,,
"Which word would you find on a dictionary page with the following guide words?
cove - cylinder",credit,cattle,,
"Would you find the word doctor on a dictionary page with the following guide words?
dessert - dust",yes,no,,
"What does the simile in this text suggest?
Tori rubbed coconut oil on her hands, which were like the parched earth during a drought.",Tori's hands were dry and cracked.,Tori's hands were hot.,,
"Which logical fallacy is used in the text?
The thing that makes Carson stand out as a remarkable cellist is that he's a marvelous musician who plays the cello splendidly.",circular reasoning: an argument that supports a claim with the claim itself,bandwagon fallacy: the assumption that the popular choice is automatically correct,"ad hominem: an attack against the person making the argument, rather than the argument itself",
"What kind of sentence is this?
Leah considers Paris the most romantic city in the world.",interrogative,declarative,exclamatory,
"Which tense does the sentence use?
Dale will read his book before bed.",present tense,future tense,past tense,
"The city of Richmond has been one of the world's biggest makers of cough drops for many years. But last month, Richmond's cough drop factories were destroyed by floods. What will probably happen to the overall supply of cough drops?",The supply will probably go down.,The supply will probably go up.,,
"The city of Booneville has been one of the world's biggest makers of cough drops for many years. But last month, Booneville's cough drop factories were destroyed by floods. What will probably happen to the overall supply of cough drops?",The supply will probably go up.,The supply will probably go down.,,
"Which tense does the sentence use?
Kate needs a new pair of shoes.",future tense,past tense,present tense,
"Last year, 50,000 people lived in the city of Fairview. But since then, 8,000 people have moved away. What probably happened to the overall supply of houses for sale in Fairview?",The supply probably went up.,The supply probably went down.,,
"Which figure of speech is used in this text?
I meant what I said
And I said what I meant. . .
An elephant's faithful
One hundred per cent!
—Dr. Seuss, Horton Hatches the Egg",chiasmus,apostrophe,,
"Which type of sentence is this?
As Will sat down on the rickety old chair, it abruptly collapsed beneath him.",simple,compound-complex,complex,compound
"What does the verbal irony in this text suggest?
While waiting for her search results, Jessica exclaimed, ""My Internet connection is as speedy as a snail!""",Jessica was patiently waiting for an Internet connection.,The Internet connection was very slow.,,
"Which type of sentence is this?
Darnell took several incredible panoramic photographs of the sweeping view from the top of Table Mountain.",simple,compound,compound-complex,complex
"Would you find the word began on a dictionary page with the following guide words?
blade - bob",no,yes,,
"What does the allusion in this text suggest?
A Good Samaritan identified only as Mr. Li captured the world's attention in May 2014 when he rushed across a street in China to catch a baby falling from a window.",The man generously helped a stranger.,The man was hoping for a reward.,,
"What is the source of the allusion in the sentence below?
Yesterday's tennis match was a classic David and Goliath story, with Hanson playing against his former team captain, Ernesto.",the Bible,a poem,,
"Would you find the word trouble on a dictionary page with the following guide words?
thrash - tiny",no,yes,,
"Is this a sentence fragment?
Derailed by miscommunication and a lack of funding, Fernando and Cody's new business venture.",yes,no,,
"Which figure of speech is used in this text?
Soft language issued from their spittleless lips as they swished in slow circles round and round the field.
—James Joyce, A Portrait of the Artist as a Young Man",chiasmus,assonance,,
"What kind of sentence is this?
What made Krysta so upset?",exclamatory,interrogative,,
"What is the source of the allusion in the sentence below?
""Baldwin's personality is very Jekyll and Hyde,"" Krysta told her brother.",U.S. history,literature,,
"Which figure of speech is used in this text?
Cole returned to the parking lot to find his car somewhat destroyed. Apparently someone had crashed into it while he was working and had broken the entire front windshield.",oxymoron,hyperbole,,
"Would you find the word pad on a dictionary page with the following guide words?
polar - private",no,yes,,
"Which word would you find on a dictionary page with the following guide words?
keep - knives",king,kangaroo,,
"Is this a sentence fragment?
In honor of Washington Irving's famous tale, the town of North Tarrytown, New York, voted to rename itself Sleepy Hollow in 1996.",no,yes,,
"Which logical fallacy is used in the text?
Mabel never lies. She told me herself, so it must be true.",circular reasoning: an argument that supports a claim with the claim itself,ad hominem: a personal attack against one's opponent,,
"What does the simile in this text suggest?
Ava rubbed coconut oil on her hands, which were like the parched earth during a drought.",Ava's hands were dry and cracked.,Ava's hands were hot.,,
"Which logical fallacy is used in the text?
On my walk to work this morning, a woman on her bike nearly ran me off the sidewalk. I hadn't realized that cyclists were so aggressive and rude!",hasty generalization: a very broad claim based on very little evidence,guilt by association: a negative association intended to discredit someone or something,,
"What does the personification in this text suggest?
The trawler plunged into the angry swells of the dark, furious sea.
—Robert Ludlum, The Bourne Identity",The sea was fierce.,The sea was deep in color.,,
"What is the source of the allusion in the sentence below?
Before Lily had even met her future husband in person, she knew about his reputation as a Romeo.",literature,Roman mythology,,
"Does the sentence use a simile or a metaphor?
My dog, Skip, is the security guard for our front yard mailbox.",simile,metaphor,,
"Is this a run-on sentence?
Located just south of Seaside, Gabriel's Restaurant offers an eclectic menu in a scenic country setting.",no,yes,,
"Which logical fallacy is used in the text?
The thing that makes Santiago stand out as a remarkable cellist is that he's a marvelous musician who plays the cello splendidly.",slippery slope fallacy: the false assumption that a small first step will lead to extreme consequences,circular reasoning: an argument that supports a claim with the claim itself,"false causation: the assumption that because two things happened together, one caused the other",
"Would you find the word sniff on a dictionary page with the following guide words?
scholar - stump",no,yes,,
"Which figure of speech is used in this text?
The Dodson family is going to spend two weeks in Ocean City, but for Mateo it will be a working vacation, since he'll be checking in with the office every day.",euphemism,oxymoron,,
"What is the source of the allusion in the sentence below?
Frank persisted despite his friends' attempts to tell him that this was a Gordian knot.",a song,ancient legend,,
"Which figure of speech is used in this text?
The past is a foreign country; they do things differently there.
—L. P. Hartley, The Go-Between",pun,metaphor,,
"Would you find the word hat on a dictionary page with the following guide words?
hickory - hum",no,yes,,
"Would you find the word brim on a dictionary page with the following guide words?
beloved - butter",no,yes,,
"What does the idiom in this text suggest?
""Speak of the devil!"" Alice declared when Richard strolled into the room.",Alice thought Richard was a troublemaker.,Alice had just been speaking about Richard.,,
"Which figure of speech is used in this text?
I don't feel like going into it, if you want to know the truth. My parents would have about two hemorrhages apiece if I told anything pretty personal about them.
—J. D. Salinger, The Catcher in the Rye",anaphora,hyperbole,,
"Which figure of speech is used in this text?
Julian's leaving his job? That's old news. He's been planning that for months.",euphemism,oxymoron,,
"Which figure of speech is used in this text?
""This box weighs a ton!"" Aaron panted. ""Cara, do you mind helping me carry it up the stairs?""",paradox,hyperbole,,
"What does the euphemism in this text suggest?
Mr. Lambert is enjoying his golden years in a luxurious beachside community just down the street from his grandchildren.",Mr. Lambert is rich.,Mr. Lambert is old.,,
"What is the source of the allusion in the sentence below?
Reopening the investigation would be like opening Pandora's box.",a song,Greek mythology,,
"Is this a run-on sentence?
In the 1970s, Asian carp were imported to clean ponds on aquaculture farms in the South; they are believed to have escaped and spread, negatively affecting fish populations as far north as the Great Lakes.",yes,no,,
"What kind of sentence is this?
The Small Dark Spot is the name of a cyclone that occurred on the planet Neptune.",declarative,exclamatory,interrogative,
"Would you find the word crude on a dictionary page with the following guide words?
carton - cuff",yes,no,,
"What is the source of the allusion in the sentence below?
There was a group of yahoos sitting at the table next to ours.",Greek mythology,literature,,
"Which figure of speech is used in this text?
Danny's room is as tidy as an overgrown garden.",verbal irony,pun,,
Suppose Lamar decides to eat the vanilla custard. Which result would be a cost?,Lamar will give up the chance to eat the peanuts. The peanuts would have been healthier than the vanilla custard.,Lamar will get to eat the vanilla custard. Lamar thinks vanilla custard will taste better than peanuts would have.,,
"Is this a run-on sentence?
In the early 1960s, Alan and Doris Litman, a couple in Pittsburgh, invented mace (a nontoxic tear gas), after one of Doris's colleagues was mugged, the Litmans wanted to create a safe product that women could use in self-defense.",yes,no,,
"What is the source of the allusion in the sentence below?
Franco's proclamations earned him a reputation as our neighborhood's own Nostradamus.",Greek mythology,history,,
"What does the idiom in this text suggest?
""Speak of the devil!"" Becky declared when Dirk strolled into the room.",Becky didn't trust Dirk.,Becky had just been speaking about Dirk.,,
"Which tense does the sentence use?
The game will start soon.",present tense,past tense,future tense,
Suppose Alec decides to watch the comedy. Which result would be a cost?,Alec will get to watch the movie that he is more excited about.,Alec will give up the chance to watch a movie with his sister.,,
"Which figure of speech is used in this text?
The salesperson tried hard to convince Bryant that the jacket was a good buy; after all, it was made of genuine imitation leather.",oxymoron,hyperbole,,
"Which tense does the sentence use?
Adam and Lisa will help the neighbors.",past tense,present tense,future tense,
"Read the following excerpt from a student essay. How can the writer best improve his or her sentence fluency?
If I became student council president, I would make significant changes at my school. I would help my fellow students by being the voice of the student body and communicating openly and effectively with the principal, board of education, school faculty and staff, and parents. For example, I would make every effort to represent students' interests on issues such as mobile phones in the classroom, healthy lunch options in the cafeteria, and improved showers and lockers in our gymnasium. In addition, I would focus on organizing more social events for students, including talent shows, sports tournaments, fashion shows, dances with exciting themes, and battle of the band competitions.",by combining sentences containing related information,by varying sentence length,,
"Would you find the word moan on a dictionary page with the following guide words?
mask - meek",no,yes,,
"Which figure of speech is used in this text?
At twenty-one, Chad felt overwhelmed with adult responsibilities and wished he could fly off to Neverland.",allusion,simile,,
"Which figure of speech is used in this text?
The audience at the 2012 Olympics cheered as, with Herculean effort, Kim Un-Guk of North Korea set an Olympic record by lifting a 153-kilogram weight.",alliteration,allusion,,
"Which figure of speech is used in this text?
At twenty-one, Eddie felt overwhelmed with adult responsibilities and wished he could fly off to Neverland.",onomatopoeia,allusion,,
"Which logical fallacy is used in the text?
I can't believe you'd hire Tyler Khan to watch your dog! Did you know that his friend adopted a dog but then took it back to the shelter after just one week?",straw man: a misrepresentation of an opponent's position that makes it easier to argue against,guilt by association: a negative association intended to discredit someone or something,,
"What is the source of the allusion in the sentence below?
Hayley had her fifteen minutes when her video of kayaking with dolphins went viral.",modern history,a song,,
"Which word would you find on a dictionary page with the following guide words?
tentacle - torpedo",tundra,those,,
"Which type of sentence is this?
Kenny always approaches difficult tasks enthusiastically, and he frequently motivates others with his energy and fervor.",compound-complex,compound,complex,simple
"Which word would you find on a dictionary page with the following guide words?
shack - spade",squirrel,source,,
"What does this Works Cited entry indicate about the cited work?
Verducci, Tom. ""David Ortiz on Cubs' Kris Bryant and Why Hitting Is Harder than Ever."" Sports Illustrated 28 Apr. 2015: n. pag. Web. 10 May 2015.",It doesn't have a date of publication.,The author's first name is Tom.,The author's first name is David.,
"Which tense does the sentence use?
Dean stirred the sauce on the stove.",past tense,future tense,present tense,
"Which word would you find on a dictionary page with the following guide words?
citizen - coil",clerk,churn,,
"Which tense does the sentence use?
The cook puts beans in the soup.",present tense,past tense,future tense,
"Which word would you find on a dictionary page with the following guide words?
few - freight",fortress,family,,
"Would you find the word librarian on a dictionary page with the following guide words?
laid - looked",yes,no,,
"What does the euphemism in this text suggest?
The Cohen family donated a number of gently loved books and toys to a local shelter.",The items were precious.,The items were not new.,,
"Which logical fallacy is used in the text?
Some people claim that William Shakespeare could have learned to write plays without formal schooling. I disagree. No one is born writing plays like that.",straw man: a misrepresentation of an opponent's position that makes it easier to argue against,appeal to nature: the assumption that natural things are always good,guilt by association: a negative association intended to discredit someone or something,
"Complete the sentence so that it uses personification.
""You might think you'll always be young,"" Mrs. Blake counseled, ""but time ()"".",affects everyone,creeps up on you,,
"Which word would you find on a dictionary page with the following guide words?
right - ruby",radish,root,,
"Which logical fallacy is used in the text?
Mayor Stanley wants to create more bicycle lanes in Fairview. However, many citizens of Fairview live far from work. It would not be realistic to force us to give up our cars and bike everywhere.",circular reasoning: an argument that supports a claim with the claim itself,straw man: a misrepresentation of an opponent's position that makes it easier to argue against,"false causation: the assumption that because two things happened together, one caused the other",
"Which figure of speech is used in this text?
Fair river! In thy bright, clear flow
Of crystal, wandering water,
Thou art an emblem of the glow
Of beauty . . . —Edgar Allan Poe, ""To the River""",apostrophe,antithesis,,
"Which figure of speech is used in this text?
Sharon insisted that her dog wasn't fat; she said that he was merely well-fed.",euphemism,hyperbole,,
"What kind of sentence is this?
How many articles did Clarence write before his publisher offered him a book contract?",declarative,exclamatory,interrogative,
"What kind of sentence is this?
I can't believe this is Luna's first time seeing the Pacific Ocean!",interrogative,exclamatory,declarative,
"Is this a sentence fragment?
Based on one theory, Mimas, one of Saturn's many moons, may have been created within that planet's icy rings.",yes,no,,
