Question,A,B,C,D,Correct Option,Subject,GPT-3.5,GPT-4
Sensations of spinothalamic tract are:,"Pain, temperature & undifferentiated touch",Static proprioception,Temperature only,Proprioception,A,Physiology,A,A
Maximum postprandial motility is seen in,Ascending colon,Transverse colon,Descending colon,Sigmoid colon,C,Physiology,B,A
Monro-kellie doctrine is related to injury of -,Head,Abdomen,Chest,Leg,A,Physiology,A,A
Continuous administration of GnRH-,Stimulates hypothalamic--pituitary axis,Suppresses hypothalamic--pituitary axis,May suppresses or stimulate hypothalamic--pituitary axis,Has so no effect on hypothalamic--pituitary axis,B,Physiology,A,B
Thyroxine is transpoed by?,Albumin,Transthyretin,Transferrin,Ceruloplasmin,A,Physiology,B,A
Calcitonin is produced by -,Thyroid,Pituitary,Pancreas,Hypothalamus,A,Physiology,A,A
Life span of neonatal RBC -,60-90 days,90-120 days,120-150 days,150-200 days,A,Physiology,A,A
What will occur with increase in alveolar ventilation rate,Decreased paial pressure of O2 in alveoli,Decreased paial pressure of CO2 in alveoli,Decreased CO2 diffusion from blood to alveoli,Decreased O2 diffusion from alveoli to blood,B,Physiology,B,B
"Cushing reflex, there is",Increased BP and Increased hea rate,Increased BP and Decreased hea rate,Decreased BP and Decreased hea rate,Decreased BP and Increased hea rate,B,Physiology,B,B
Action of drug that stimulates carotid is expected to cause:,| In pH of blood,| pCO2 of arterial blood,| Urinary Na excretion,| Plasma C1 concentration,B,Physiology,B,B
Pulmonary wedge pressure is indirectly,Left atrial pressure,Right atrial pressure,Right ventricular pressure,Left ventricular pressure,A,Physiology,A,A
Which of the following is the most important stimulus for the secretion of bile:,Bile salts,Bile acid,Secretin,CCK,A,Physiology,C,C
Activation of which of the following hormone's receptors produces E.Coli induced diarrhoea?,Ghrelin,Guanylin,VIP,Somatostatin,B,Physiology,B,B
Blood flow to skeletal muscles (ml/min),100,200,400,800,D,Physiology,C,D
Earliest change in high altitude is:,Hyperventilation,Decrease in work capacity,Drowsiness,Polycythemia,A,Physiology,D,A
Which of the following is a neuroendocrine function of lungs?,Erythropoiethin secretion,Angiotensin conversion,Manufacture surfactant,Fibrinolytic substance secretion,B,Physiology,A,A
"For sodium-potassium pump, the coupling ratio is",1:01,2:03,3:02,1:04,C,Physiology,C,C
GFR is increased by,ANP,Vasopressin,Histamine,Endothelium,A,Physiology,A,A
RMP of the neuron is:,-700 V,- 7 V,-170 mV,-70 mV,D,Physiology,D,D
ACTH level is higher during:,Early morning,Evening,Afternoon,Night,A,Physiology,A,A
HCO3 is absorbed through?,PCT,DCT,Loop of henle,Collecting duct,A,Physiology,A,A
The primary action of Nitric oxide (NO) in the gastrointestinal tract is,Vasodilatation,Vasoconstriction,Gastrointestinal smooth muscle relaxation,Gastrointestinal slow smooth muscle contraction,C,Physiology,C,C
Intracellular water is how much percentage of body weight,40%,60%,25%,80%,A,Physiology,B,A
"The blood levels of 1,25 dihydroxycholecalciferol is positively regulated by:-",PTH,Calcium,Magnesium,25 OH cholecalciferol,A,Physiology,A,A
During standing. In apex of lung -,Blood flow is high,Ventilation is high,V/Q is high,V/Q is low,C,Physiology,C,C
Change in the diastolic BP upon standing comes back to normal within,15-30 sec,30-60 sec,60-90 sec,90-120sec,B,Physiology,A,A
PO2 over 8kPa is (Hp saturation),60%,70%,80%,90%,D,Physiology,C,D
Which is only filtered into renal tubules?,DTPA,DMSA,MAG3,EC,A,Physiology,A,A
Which of the following triggers muscle contraction,Ca2+ binding tropomyosin,Ca2+ binding troponin C,Ca2+ binding troponin I,ATP breakdown,B,Physiology,A,B
Action potential is transmitted in myofibrils via:,Terminal cisterns,T- Tubules,Longitudinal,Sarcomere,B,Physiology,B,B
Hypocalcemia in immediate post-op period following excision of parathyroid adenoma is due to,Stress,Hypercalciuria,Increased calcitonin,Increased uptake by bones,D,Physiology,D,D
"During regulatory volume decrease, many cells will increase:",Their volume,Influx of Na+,Efflux of K+,Synthesis of sorbitol,C,Physiology,A,C
Resting membrane potential depends mainly on-,K,Na,Cl,HCO3,A,Physiology,A,A
Pulmonary vasoconstriction is caused by,Prostacyclin,Alpha-2 stimulation,Hypoxia,Histamine,C,Physiology,C,C
Spermatogenesis occurs at,Body temperature,Temperature lower than core body temperature,Temperature higher than core body temperature,Temperature does not play a role,B,Physiology,B,B
The primary action on Nitric oxide (NO) in the gastrointestinal tract is,Vasodilatation,Vasoconstriction,Gastrointestinal smooth muscle relaxation,Gastrointestinal slow smooth muscle contraction,C,Physiology,C,C
Decreased basal metabolic rate is seen in,Obesity,Hypehyroidism,Feeding,Exercise,A,Physiology,B,A
Largest % of blood volume in,Aoa,Aery /Aerioles,Venules / Veins,Capillaries,C,Physiology,C,C
Which of the following would help in the bridging the fibrin in a clot and stabilize the clot?,Factor XIII,Factor V,Factor VIII,Factor III,A,Physiology,A,A
Which does not pass from the superior cerebellar peduncle?,Dentatorubral tract,Anterior spinocerebellar tract,Posterior spinocerebellar tract,Tectocerebellar tract,C,Physiology,A,C
Haldane effect is:,Effect of O2 on CO2 carriage in blood,Effect of CO2 on O2 carriage in blood,Effect of PCO2 on CO2 carriage in blood,Effect of pH on oxygen carriage in blood,A,Physiology,A,A
What would tend to decrease GFR by more than 10% in a normal kidney?,Decrease in renal aerial pressure from 100 to 85 mm Hg,50% decrease in afferent aeriolar resistance,50% decrease in efferent aeriolar resistance,50% increase in the glomerular capillary filtration coefficient,C,Physiology,A,A
Sleep center is located in,Basal ganglia,Medulla,Hypothalamus,Cerebellum,C,Physiology,C,C
Maximum phosphate is reabsorbed in -,PCT,DCT,Loop of Henie,Collectingduct,A,Physiology,A,A
Which one of the following Pituitary hormones is an Opioid peptide?,ACTH,Beta endorphin,Alpha melanocyte stimulating hormone,Beta melanocyte stimulating hormone,B,Physiology,B,B
Exercise is also prescribed as an adjuvant treatment for depression. Most probably is acts by:,Increasing pulse pressure,Improving hemodynamics,Raising endorphin levels,Inducing good sleep,C,Physiology,C,C
Daily water loss in sweat during high activities,50-100ml,200-400ml,500-700ml,1000- 1200ml,A,Physiology,B,D
Paradoxical sleep is?,Seen in obstructive sleep apnea,REM sleep,NRM sleep,Narcolepsy,B,Physiology,B,B
"First change observed in distal part, of a cut nerve is",Axonal degeneration,Sprouting,Myelin degeneration,Schwann cells proliferation,A,Physiology,A,A
Transport of carbon monoxide (CO) is diffusion limited because-,High affinity of CO for hemoglobin,Alveolar membrane is less permeable CO,CO crosses epithelial barrier slowly,ON exposure to air there is sudden increase in partial pressure,A,Physiology,C,A
Which one of the following possesses a distinct internal elastic lamina?,Capillary,Metaeriole,Aeriole,Muscular aery,D,Physiology,B,A
A cross-sectional view of a skeletal muscle fiber through the H-zone would show the presence of:,Actin & myosin,Titin & myosin,Actin & titin,Myosin only,D,Physiology,B,D
Which of these is not a cause of rightward shifted to right in?,Hyperkalemia,Hypokalemia,Anemia,Metabalic alkalosis,B,Physiology,B,D
"A person's electrocardiogram (ECG) has no P wave, but has a normal QRS complex and a normal T wave. Therefore, his pacemaker is located in the",Sinoatrial (SA) node,Atrioventricular (AV) node,Bundle of His,Purkinje system,B,Physiology,A,A
The main cause of increased blood flow to exercising muscles is,Raised blood pressure,Vasodilatation due to local metabolites,Increased sympathetic discharge to peripheral vessels,Increased hea rate,B,Physiology,B,B
Normal capillary wedge pressure,0-2 mm Hg,5-10 mm Hg,15-20 mm Hg,20-30 mm Hg,B,Physiology,B,B
Which of the following helps to anchor an epithelial cell to the basement membrane?,Adherent junction,Connexon,Gap junction,Hemidesmosome,D,Physiology,D,D
Which of the following will decrease the physiologic dead space?,Emphysema,Neck flexion,Increase in tidal volume,IPPV,B,Physiology,C,C
A pool of presynaptic neurons innervate the dendrites of a postsynaptic neuron. Electrical signals are transferred from the dendrites to the soma of the postsynaptic neuron by which process?,Active transpo,Capacitive discharge,Diffusion,Electrotonic conduction,D,Physiology,D,D
A man is given continuous testosterone. It would lead to,Azoospermia,Increased sperm motility,Increased spermatogenesis,Increased gonadotrophins,A,Physiology,A,A
Physiological effect that is not produced by stimulation of Kappa opioid receptor is:,Sedation,Diuresis,Miosis,Constipation,D,Physiology,B,B
"A 50 years old male presents with severe refractory hypeension, weakness, muscle cramps and hypokalemia, the most likely diagnosis is",Hypoaldosteronism,Hyperaldosteronism,Cushing syndrome,Pheochromocytoma,A,Physiology,B,B
The conduction velocity is maximum in,SA node,AV node,Bundle of his,Purkinje fibres,D,Physiology,D,D
A 10oC decrease in temperature causes decrease in cerebral metabolic rate by,10%,30%,50%,70%,D,Physiology,B,C
"""NO"" is synthesized from",Tryptophan,L - citrulline,Lysine,L - arginine,D,Physiology,A,D
TSH on surface receptor uses second messenger as,cAMP,cGMP,Ca2+,IP3,A,Physiology,A,A
Carbon monoxide poisoning causes which type of hypoxia?,Anemic hypoxia,Hypoxic hypoxia,Stagnant hypoxia,Histotoxic hypoxia,A,Physiology,B,A
A luminal cell membrane Na+ channel is the main pathway for Na+ reabsorption in:,Proximal tubule cells,Thick ascending limb cells,Distal convoluted tubule cells,Collecting duct principal cells,D,Physiology,A,A
Which structure(s) in the cerebellum has/have a topographical representation of the body?,Dentate nucleus,Lateral hemispheres,Flocculonodular lobe,Vermis and intermediate hemisphere,D,Physiology,D,D
Pain is carried by w hich type of nerve fibres -,aa,b,B,C,D,Physiology,C,C
Hea rate increase with one of the following?,Stimulation of trigeminal nerve pain receptor,Increased intracranial tension,Decreased stimulation of Baroreceptors,Increased parasympathetic stimulation,C,Physiology,B,B
"In the RBC series, proliferation occurs at which stage?",Early normoblast,Intermediate normoblast,Late normoblast,Proerythroblast,A,Physiology,D,D
Normal inspiratory reserve volume (IRV) is -,500ml,1200ml,3000 ml,4900 ml,C,Physiology,B,B
Following is not a feature of delirium?,Memory loss,Illusion,Intact attention,Disturbed sleep,C,Psychiatry,C,C
Kleine Levine syndrome is,Insomnia,Depression,Anxiety,Hypersomnia,D,Psychiatry,D,D
Who is the Founder of school of psychoanalysis and Psychotherapy is after the name of?,Bleuler,Freud,Kraeplin,Melanie Klien,B,Psychiatry,B,B
"A 15 year old child comes with multiple movements of hand and whistling sounds, which are preceded by premonitory urge and is unable to do work at school and at home and leads to distress. These had an onset when he was 10 years age. He showed some improvement with haloperidol. What is the diagnosis?",Generalized anxiety disorder,Obsessive-compulsive disorder,Panic disorder,Tourette's syndrome,D,Psychiatry,D,D
Unfamiliarity of familiar things is seen in:,Deja vu,Jamais vu,Deja entendu,Deja pence,B,Psychiatry,B,B
Which of the following is not a pa of Becks triad?,Hopelessness,Wohlessness,Helplessness,Sleeplessness,D,Psychiatry,B,D
In which of the following conditions the sensory loss is clearly demarcated by midline?,Conversion disorder,Charcot's neuropathy,Peripheral neuritis,Leprosy,A,Psychiatry,D,A
Which of the following is considered as an anxiolytic substance?,Caffeine,Cholecystokinin,Neuropeptide Y,Carbondioxide,C,Psychiatry,C,C
Morbid jealousy is seen with,Alcoholism,Opium,Cannabis,Amphetamine,A,Psychiatry,A,A
"""Amotivational syndrome"" is caused by",Cannabis,Cocaine,Alcohol,Diazepam,A,Psychiatry,A,A
Which of the following therapy is used in treatment of borderline personality disorder?,Modeling,Cognitive behavioural therapy,Dialectical behaviour therapy,Exposure and response prevention,C,Psychiatry,C,C
Desensitization is a type of,Psychotherapy,Psychoanalysis,Behavioural therapy,Psycodynamic therapy,C,Psychiatry,B,B
Reversible cause of dementia is,Hypothyroidism,Alzheimer's disease,Huntington chorea,Vitamin A deficiency,A,Psychiatry,A,A
"""I am dead"" is a form of",Nihilistic delusion,Somatic delusion,Delusion of Infidelity,Delusion of reference,A,Psychiatry,A,B
Most common symptom associated with adult OCD?,Pathological doubt,Need for symmetry,Sexual,Aggressive,A,Psychiatry,A,A
"A chronic alcoholic patient is brought to the emergency depament by a family member. The person has not consumed alcohol since two days due to unavailability. The person complained of nausea, vomiting and dizziness. On the beginning of the third day, he developed seizures (GTCS). Which of the following would be best medications to manage the seizure of this patient?",Sodium valproate,Phenytoin,Diazepam,Carbamazepine,C,Psychiatry,C,C
"An IT employee after taking up the job is feeling guilty, hopeless and not able to concentrate on work. His symptoms started 3 years back when he entered college. Likely diagnosis?",Depressive disorder,Dysthymia,Adjustment disorder,Cyclothymia,B,Psychiatry,A,B
Disruption or disorganisation of biological rhythm is observed in,Schizophrenia,Anxiety,Depression,Mania,C,Psychiatry,A,C
Drug used for narcoanalysis is,Atropine,Scopolamine,Propranolol,Naltrexone,B,Psychiatry,B,B
Maintaining sick role by any means is a characteristic feature of:,Hypochondriasis,Somatization disorder,Conversion disorder,Factitious disorder,D,Psychiatry,A,D
Lithium use in pregnancy leads to which of the following effect on baby?,CVS defect,Urogenital defect,Neural tube defect,Facial defects,A,Psychiatry,C,A
"A 29 year old woman has severe manic episode. She has been diagnosed with bipolar affective disorder. Among the following, which one is not used for the prophylaxis of her illness?",Valproate,Lithium,Carbamazepine,Trifluoperazine,D,Psychiatry,D,D
What is Agoraphobia?,Fear of heights,Fear of closed spaces,Fear of open spaces,Fear of dogs,C,Psychiatry,C,C
which of the following SSRi is used in the management of pathological emotions,Escitalopram,paroxetine,clomipramine,fluoxetine,A,Psychiatry,A,A
Blood sample of a 45 year old male shown increased levels of homovanillic acid. This patient is most likely suffering from:-,Dementia,Schizophrenia,Depression,Parkinson's disease,B,Psychiatry,D,B
The specific laboratory finding often reflect the clinical manifestations of Neuroleptic Malignant Syndrome (NMS) is,Elevated Creatine kinase,Hypocalcemia,Increased Alkaline phosphatase,Leukocytosis,A,Psychiatry,A,A
Catastrophic reaction is feature of,Dementia,Schizophrenia,Delirium,Anxiety,A,Psychiatry,A,A
Most common delusional disorder in male,persecutory,grandiose,erotomanic,jealousy,C,Psychiatry,A,A
"A young lady was admitted after taking overdose of diazepam after broken affair, she has history of slitting her wrist previously. Most likely diagnosis:",Narcisstic personality disorder,Dependent personality disorder,Borderline personality disorder,Histrionic personality disorder,C,Psychiatry,B,B
"A patient complaints of sadness of mood, increased letharg, early morning awakening, loss of interest and repos no will to live and hears voices asking her to kill self. What is the diagnosis?",Schizophrenia,Major depressive disorder plus psychosis,Schizoaffective disorder,Schizotypal personality disorder,B,Psychiatry,B,B
"A 13 year young boy is brought by his parents with history of frequent fighting at school, disciplinary problems, stealing money, assaulting his batch mates and being weak in studies. What is the most appropriate diagnosis for this child:",Attention deficit hyperactivity disorder,Conduct disorder,Autism,Nothing abnormal (teenage phenomenon),B,Psychiatry,B,B
Not seen in anorexia nervosa:,Osteoporosis,Refusal to feeds,Weight loss,Menorrhagia,D,Psychiatry,A,D
Kleptomania is?,Irresistible desire to set fire,Irresistible desire to steal things,Compulsive hair pulling,Pathological gambling,B,Psychiatry,B,B
What is a feature of narcolepsy-,Insomnia,Hypersomnia at day time,Bimism,Somnambulism,B,Psychiatry,B,B
"Behavioural problems caused by senility, drug damage, brain injury or disease, and the toxic effects of poisons are classified as __________ disorders",Organic,Substance use,Psychotic,Psychosomatic,A,Psychiatry,A,A
Maximum score that can be obtained in MMSE is,13,30,47,55,B,Psychiatry,B,B
Schizophrenia with the worst prognosis,Catatonic,Paranoid,Hebephrenic,Undifferentiated,C,Psychiatry,B,C
"Laloo, a 40-year-old male has recently staed writing books. But the matter in his book could not be understood by anybody since it contained words which were never there in any dictionary and the theme was very disjoint. Nowadays he has become very shy and self absorbed. When he addresses people he speaks about meta philosophical ideas. What is the likely diagnosis?",Mania,Schizophrenia,Depression,Delusional disorder,B,Psychiatry,B,B
Which of the following drugs could be prescribed for a child who suffer from night terrors?,Meprobamate,Clonazepam,Lithium,Amphetamine,B,Psychiatry,B,B
Rett's syndrome is characterized by -,Regression of language and motor milestones,Hyperactive child,Normal weight,Macrocephaly,A,Psychiatry,A,A
A distinguishing feature of psychotic disorders is,Suspiciousness,Obsessions and Compulsions,Confusion between fantasy and reality,Presence of severe depression,C,Psychiatry,C,C
"A lady while driving a car meets with an accident. She was admitted in an ICU for 6 months. After being discharged, she often gets up in night and feels terrified and has fear to sit in car again. The diagnosis is :",Panic Disorder,Phobia,Conversion disorder,Post-traumatic stress disorder,D,Psychiatry,D,D
Catatonic schizophrenia is associated with,Paranoid thoughts,Suicidal behavior,Motor symptoms,Mental Retardation,C,Psychiatry,C,C
The term 'schizophrenia' was coined by,Eugene Bleuler,Sigmund Freud,Hecker,Johann christian reil,A,Psychiatry,A,A
Symptom of neuroleptic malignant syndrome -,Hypotension,Hypothermia,Increased Magnesium level in blood,Catatonia and stupor,D,Psychiatry,C,C
Most common cause of suicide is,Schizophrenia,Depression,Cyclothymia,Mania,B,Psychiatry,B,B
Max cut oft duration for prolonged seizures post ECT according to American psychiatric society:,>90 seconds,>150 seconds,>120 seconds,>180 seconds,D,Psychiatry,B,C
Which of the following medication is least effective against depression?,Valproate,Lamotrigine,Lithium,Aripiprazole,A,Psychiatry,B,A
"A 40 year old male presents with sudden onset breathlessness, anxiety, palpitation, hot flushes, dizziness & chest pain. He is afraid of dying. Physical examination is normal. ECG & X-ray are also normal. What is the diagnosis?",Panic attack,Anxiety disorder,Malingering,Acute psychosis,A,Psychiatry,A,A
"A homosexual person feels that ""he is a woman trapped in a man's body"" and has persistent discomfo with his sex. Most likely diagnosis is:",Trans - sexualism,Transvestism,Voyeurism,Paraphilias,A,Psychiatry,A,A
Term 'Catatonia' was used by,Karl kahlbaum,Adolf Meyer,Leo Kanner,Karen Horney,A,Psychiatry,A,A
Concrete thinking stage of cognitive development is,0-2 years,2-5 years,5-10 years,10-15 years,C,Psychiatry,C,C
Most common cause dementia in an adult is,Alzheimer's,Multi-infarct,Pick disease,Metabolic cause,A,Psychiatry,A,A
Excessive sexual desire in females is known as?,Nymphomania,Satyriasis,Frigidity,Impotency,A,Psychiatry,A,A
Which of the following drugs that is known to cause dependence is most commonly abused?,Cocaine,Heroin,Amphetamine,Cannabis,D,Psychiatry,B,C
Which of the following is a date rape drug?,Cocaine,Heroin,Flunitrazepam,Methamphetamine,C,Psychiatry,C,C
The recollection of events which happened one week before is,Working memory,Recent memory,Delayed memory,Remote memory,A,Psychiatry,B,C
Agoraphobia is,Fear of open spaces,Fear of closed spaces,Fear of heights,Fear of crowded places,A,Psychiatry,A,A
A patient presents to the emergency depament with self harm and indicates suicidal intent. Which of the following conditions does not warrant an immediate specialist assessment?,Formal thought disorder,Acute alcohol intoxication,Chronic severe physical illness,Social isolation,B,Psychiatry,C,D
1st line treatment for smoking cessation includes,Noriptyline,Clonidine,Varenicline,Buspirone,C,Psychiatry,C,C
A patient taking 120 mL alcohol everyday since last 12 years is brought to the hospital by his wife and is diagnosed to have alcohol dependence syndrome. Which of the following drug should be avoided in the management?,Phenytoin,Disulfiram,Naltrexone,Acamprosate,B,Psychiatry,C,A
Flash back is seen in,flunitrazepam,LSD,toluene,anabolic androgenic steroids,B,Psychiatry,A,B
The following name is associated with psychodynamic theory,Carl Jung,Sigmund Freud,Emil Kraeplin,Eugen Bleuler,B,Psychiatry,B,B
Early onset and bad prognosis is seen in:,Catatonic Schizophrenia,Hebephrenic Schizophrenia,Paranoid Schizophrenia,Simple Schizophrenia,B,Psychiatry,B,B
NOT a paranoid symptom,Delusion of persecution,Delusion of infidelity,Delusion of grandeur,Thought alienation,B,Psychiatry,B,C
"Arrange the following subtypes of schizophrenia, in order of prognosis, with the best prognosis first and the worst prognosis last, 1. Paranoid schizophrenia2. Catatonic schizophrenia3. Simple schizophrenia4. Disorganised schizophrenia",4-2-1-3,2-1-3-4,2-1-4-3,1-2-4-3,C,Psychiatry,B,D
Delusion of infidelity is seen in:,Othello syndrome,Dechlerambault syndrome,Magnan syndrome,Cotard syndrome,A,Psychiatry,A,A
Derealisation and depersonalization are seen in which type of disorder,Dissociative disorder,Personality disorder,Mania,Somatoform disorder,A,Psychiatry,A,A
The most common form of dissociation hysteria is,Fugue,Amnesia,Multiple perosonality,Somnambulism,B,Psychiatry,C,A
Which of the following is not a neurotic defense mechanism?,Isolation,Regression,Reaction formation,Undoing,B,Psychiatry,D,
"In depressions, there is deficiency of -",5-HT,Acetylcholine,Dopamine,GABA,A,Psychiatry,A,A
Absolute contraindication to ECT is:,Glaucoma,Brain tumor,Aoic aneurism,MI,B,Psychiatry,A,A
Sigmund Freud is associated with which of the following,Group Psychotherapy,Psychoanalysis,Sociogram,Cognitive Behavior Therapy,B,Psychiatry,B,B
Which of the following is not seen in a case of borderline personality disorder?,Identity crisis,Dissociative events,Risk taking behaviour,Strong interpersonal relationships,D,Psychiatry,B,D
Area of brain resistant to neurofibrillary tangles in Alzheimer's disease:,Visual association area,Entorhinal coex,Lateral geniculate body,Cuneal gyrus area VI/temporal lobe,C,Psychiatry,B,C
Naltrexone is used in opioid addiction because:,To treat withdrawal symptoms,To treat overdose of opioids and prevent respiratory depression,To prevent relapse in highly motivated patients,Has addiction potential; used for detoxification of opioid,C,Psychiatry,C,C
Many of our bad habits of day-to-day life can be removed by:,Positive conditioning,Negative conditioning,Biofeedback,Generalization,B,Psychiatry,A,A
which of the following SNRI used in the management of stress urinary incontinence,brofromine,citalopram,nefazodone,duloxetine,D,Psychiatry,D,D
Method of Substance use shown in Figure is mainly used for,Ganja,Bhang,Charas,Cocaine,D,Psychiatry,C,A
A young lady was admitted with h/o taking over dose of diazepam after broken affair. She has history of slitting her wrist previously. Most likely diagnosis is:,Narcissistic PD,Dependent PD,Borderline PD,Histrionic PD,C,Psychiatry,B,B
a child has come with depressive symptoms and was staed on anti depressent. which is the antidepressent used in children,clomipramine,fluoxetine,amitriptilline,escitaloprm,B,Psychiatry,B,B
Double depression in:-,Major depressive disorder from 2 years,Major depression with OCD,Depression with dysthymia,Depression with anxiety attack,C,Psychiatry,C,C
"Benzodiazepines are used in treatment of somnambulism, as they-",Increase the duration of NREM III and IV,Increase the duration of REM sleep,Decrease the duration of NREM III and IV,Decrease the duration of REM sleep,C,Psychiatry,B,A
Perseveration is:,Persistent and inappropriate repetition of the same thoughts,Feeling of distress in a patient with schizophrenia,Characteristic of schizophrenia,Characteristic of obsessive compulsive disorder,A,Psychiatry,A,A
A 72 yr. old male lost 10kgs since last 3 months. He had profuse guilt for the mistakes he has done in life and doesn't sleep more than 4 hrs. per day. The probable diagnosis is,Schizophrenia,Dysthymia,Involutional melancholia,Anhedonia,B,Psychiatry,C,C
"A chronic alcoholic patient is brought to the emergency department by his wife. The person has not consumed alcohol for the past two days due to religious reasons. The person complained of nausea, vomiting and dizziness. On the second day. he developed seizures, that progressed to generalized tonic clonic seizures (GTCS). Which of the following would be best medication to manage the seizure of the patient?",Sodium valproate,Phenytoin,Diazepam,Carbamazepine,C,Psychiatry,C,C
Typical change in problem behaviour shows how many stages,2,3,4,5,D,Psychiatry,B,C
Erotomania is seen in:,Schizophrenia,Mania,Neurosis,Obsessive compulsive disorder,A,Psychiatry,A,A
